number,value,datetime_start,datetime_complete,duration,params_batch_size,params_channels,params_dropout,params_lr,params_weight_decay,system_attrs_tpe:relative_params:0,state
0,0.9986412943148505,2026-10-02 14:47:13.379810,2026-10-02 14:48:19.391025,0 days 00:01:06.011215,16,small,0.5,0.0007106591851092234,0.00025378155082656634,,COMPLETE
1,0.9972826086956521,2026-10-02 14:48:19.424718,2026-10-02 14:49:19.707106,0 days 00:01:00.282388,32,small,0.1,0.0015317709628184257,0.0001256104370001356,,COMPLETE
2,0.9986412943148505,2026-10-02 14:49:19.732137,2026-10-02 14:51:17.745293,0 days 00:01:58.013156,32,large,0.4,0.0008110848199986004,6.290644294586145e-06,,COMPLETE
3,0.9959238829445515,2026-10-02 14:51:17.771652,2026-10-02 14:53:20.352899,0 days 00:02:02.581247,64,large,0.5,0.0009802925297345284,0.0017123375973163992,,COMPLETE
4,0.9986412943148505,2026-10-02 14:53:20.381415,2026-10-02 14:54:43.703330,0 days 00:01:23.321915,32,medium,0.5,0.0006049716507542575,1.0842262717330169e-05,,COMPLETE
5,0.971305377340441,2026-10-02 14:54:43.733257,2026-10-02 14:55:10.223009,0 days 00:00:26.489752,64,medium,0.5,0.001379251735419649,0.003795853142670641,,PRUNED
6,0.9891554016494867,2026-10-02 14:55:10.247192,2026-10-02 14:56:20.420166,0 days 00:01:10.172974,16,large,0.1,0.0011885603371219744,0.0020651425578959264,,PRUNED
7,0.9686532713792398,2026-10-02 14:56:20.456279,2026-10-02 14:56:58.098618,0 days 00:00:37.642339,32,large,0.4,0.0006821416720689545,6.235377135673162e-06,,PRUNED
8,0.9972826086956521,2026-10-02 14:56:58.122062,2026-10-02 14:57:55.673878,0 days 00:00:57.551816,16,small,0.0,0.00030383889771994457,0.0028340904295147754,,PRUNED
9,0.9796931030159375,2026-10-02 14:57:55.705928,2026-10-02 14:58:24.361319,0 days 00:00:28.655391,16,medium,0.5,0.0012601416950106597,7.742116473996259e-05,,PRUNED
10,0.9796864958874321,2026-10-02 14:58:24.390389,2026-10-02 14:58:47.341109,0 days 00:00:22.950720,16,small,0.2,0.00035983623246081084,3.3424835956993336e-05,"{""batch_size"": 16, ""channels"": ""small"", ""dropout"": 0.2, ""lr"": 0.00035983623246081084, ""weight_decay"": 3.3424835956993336e-05}",PRUNED
11,0.9904884983199793,2026-10-02 14:58:47.369065,2026-10-02 14:59:21.892480,0 days 00:00:34.523415,16,small,0.4,0.0008695361565231193,0.0002888312485023287,"{""batch_size"": 16, ""channels"": ""small"", ""dropout"": 0.4, ""lr"": 0.0008695361565231193, ""weight_decay"": 0.0002888312485023287}",PRUNED
12,0.9959238829445515,2026-10-02 14:59:21.916224,2026-10-02 15:00:20.405490,0 days 00:00:58.489266,16,small,0.5,0.0003129182228948965,0.0011148990645165676,"{""batch_size"": 16, ""channels"": ""small"", ""dropout"": 0.5, ""lr"": 0.0003129182228948965, ""weight_decay"": 0.0011148990645165676}",PRUNED
13,0.9918475852902082,2026-10-02 15:00:20.429433,2026-10-02 15:02:02.738696,0 days 00:01:42.309263,32,large,0.4,0.001072389443096013,1.331288691146021e-06,"{""batch_size"": 32, ""channels"": ""large"", ""dropout"": 0.4, ""lr"": 0.001072389443096013, ""weight_decay"": 1.331288691146021e-06}",PRUNED
14,0.9877242726599963,2026-10-02 15:02:02.763611,2026-10-02 15:03:03.135527,0 days 00:01:00.371916,32,large,0.30000000000000004,0.0022156030611932397,8.633875289873691e-06,"{""batch_size"": 32, ""channels"": ""large"", ""dropout"": 0.30000000000000004, ""lr"": 0.0022156030611932397, ""weight_decay"": 8.633875289873691e-06}",PRUNED
15,0.9986412943148505,2026-10-02 15:07:56.864443,2026-10-02 15:09:05.275616,0 days 00:01:08.411173,16,small,0.5,0.0017015895405780182,1.0497068198165518e-06,"{""batch_size"": 16, ""channels"": ""small"", ""dropout"": 0.5, ""lr"": 0.0017015895405780182, ""weight_decay"": 1.0497068198165518e-06}",COMPLETE
16,0.8839428864248369,2026-10-02 15:09:05.305521,2026-10-02 15:10:11.542779,0 days 00:01:06.237258,16,small,0.5,0.0018434253522032755,0.000950447320815478,"{""batch_size"": 16, ""channels"": ""small"", ""dropout"": 0.5, ""lr"": 0.0018434253522032755, ""weight_decay"": 0.000950447320815478}",PRUNED
17,0.9757577153230038,2026-10-02 15:10:11.565994,2026-10-02 15:10:38.053995,0 days 00:00:26.488001,32,small,0.4,0.0004657751839763294,0.0057927293450868635,"{""batch_size"": 32, ""channels"": ""small"", ""dropout"": 0.4, ""lr"": 0.0004657751839763294, ""weight_decay"": 0.0057927293450868635}",PRUNED
18,0.9645435796311921,2026-10-02 15:10:38.078963,2026-10-02 15:11:14.132178,0 days 00:00:36.053215,32,large,0.5,0.00039559692210260224,0.00011316519689017485,"{""batch_size"": 32, ""channels"": ""large"", ""dropout"": 0.5, ""lr"": 0.00039559692210260224, ""weight_decay"": 0.00011316519689017485}",PRUNED
19,0.9891414710557483,2026-10-02 15:11:14.157509,2026-10-02 15:12:14.244118,0 days 00:01:00.086609,32,large,0.2,0.0007332444128055686,2.776959848764488e-06,"{""batch_size"": 32, ""channels"": ""large"", ""dropout"": 0.2, ""lr"": 0.0007332444128055686, ""weight_decay"": 2.776959848764488e-06}",PRUNED
20,0.9740709796921687,2026-10-02 15:12:14.271840,2026-10-02 15:12:52.000914,0 days 00:00:37.729074,32,large,0.4,0.0007767091516751274,0.0008718000949103255,"{""batch_size"": 32, ""channels"": ""large"", ""dropout"": 0.4, ""lr"": 0.0007767091516751274, ""weight_decay"": 0.0008718000949103255}",PRUNED
21,0.9438147955569038,2026-10-02 15:12:52.024466,2026-10-02 15:13:19.471196,0 days 00:00:27.446730,32,medium,0.5,0.0007034451833306649,2.4378980385911206e-05,"{""batch_size"": 32, ""channels"": ""medium"", ""dropout"": 0.5, ""lr"": 0.0007034451833306649, ""weight_decay"": 2.4378980385911206e-05}",PRUNED
22,0.9877673130193906,2026-10-02 15:13:19.498481,2026-10-02 15:14:03.567553,0 days 00:00:44.069072,16,small,0.5,0.0005188982540536844,0.0021988808957829754,"{""batch_size"": 16, ""channels"": ""small"", ""dropout"": 0.5, ""lr"": 0.0005188982540536844, ""weight_decay"": 0.0021988808957829754}",PRUNED
23,0.9878146732419449,2026-10-02 15:14:03.591420,2026-10-02 15:14:37.552163,0 days 00:00:33.960743,16,small,0.5,0.0005515969558876519,5.47241397121472e-05,"{""batch_size"": 16, ""channels"": ""small"", ""dropout"": 0.5, ""lr"": 0.0005515969558876519, ""weight_decay"": 5.47241397121472e-05}",PRUNED
24,0.9797849730071447,2026-10-02 15:14:37.574481,2026-10-02 15:15:04.506070,0 days 00:00:26.931589,32,medium,0.5,0.00048543797929642,7.828343020417897e-06,"{""batch_size"": 32, ""channels"": ""medium"", ""dropout"": 0.5, ""lr"": 0.00048543797929642, ""weight_decay"": 7.828343020417897e-06}",PRUNED
25,0.9864829319616554,2026-10-02 15:15:04.532482,2026-10-02 15:15:38.826807,0 days 00:00:34.294325,16,small,0.4,0.0005220158831513369,0.00037294183331563737,"{""batch_size"": 16, ""channels"": ""small"", ""dropout"": 0.4, ""lr"": 0.0005220158831513369, ""weight_decay"": 0.00037294183331563737}",PRUNED
26,0.9456944275418826,2026-10-02 15:15:38.853161,2026-10-02 15:16:05.906206,0 days 00:00:27.053045,32,medium,0.4,0.0004288571054107767,1.5560723445789661e-06,"{""batch_size"": 32, ""channels"": ""medium"", ""dropout"": 0.4, ""lr"": 0.0004288571054107767, ""weight_decay"": 1.5560723445789661e-06}",PRUNED
27,0.9729803563623274,2026-10-02 15:16:05.929776,2026-10-02 15:16:43.163196,0 days 00:00:37.233420,32,large,0.5,0.0009811067723407756,2.4781762636211752e-05,"{""batch_size"": 32, ""channels"": ""large"", ""dropout"": 0.5, ""lr"": 0.0009811067723407756, ""weight_decay"": 2.4781762636211752e-05}",PRUNED
28,0.9904846329719776,2026-10-02 15:16:43.193797,2026-10-02 15:17:17.086438,0 days 00:00:33.892641,16,small,0.5,0.0009498067379069693,2.291947408083631e-06,"{""batch_size"": 16, ""channels"": ""small"", ""dropout"": 0.5, ""lr"": 0.0009498067379069693, ""weight_decay"": 2.291947408083631e-06}",PRUNED
29,0.9576204203283707,2026-10-02 15:17:17.109778,2026-10-02 15:18:15.832547,0 days 00:00:58.722769,32,large,0.30000000000000004,0.0008436839913203316,5.8395033300558206e-05,"{""batch_size"": 32, ""channels"": ""large"", ""dropout"": 0.30000000000000004, ""lr"": 0.0008436839913203316, ""weight_decay"": 5.8395033300558206e-05}",PRUNED
